### ISSUE TITLE
Android app unable to complete QUIC handshake

### ISSUE THREAD

**Issue by RenjieTang** [envoyproxy/envoy-mobile#2515]
Repro steps:
1. Patch in https://github.com/envoyproxy/envoy-mobile/pull/2514
2. Delete the TCP_KEEP_ALIVE code in https://github.com/envoyproxy/envoy/blob/main/source/common/upstream/upstream_impl.cc#L150 so that the QUIC socket can be successfully set up, a known [issue](https://github.com/envoyproxy/envoy/issues/22663)
3. Build //examples/java/hello_world:hello_envoy
4. Run it on an Android device

I found that the SSL handshake advances to a state where it wants to read handshake data.
However, the EnvoyQuicClientSession never receives any data.

It smells like a problem with the socket setup in Android?

**Comment by RenjieTang** [comment]
I forgot to mention that the repro is dependent on https://github.com/envoyproxy/envoy/issues/22663 being fixed.

Currently one can delete https://github.com/envoyproxy/envoy/blob/main/source/common/upstream/upstream_impl.cc#L150 as a workaround

**Comment by RyanTheOptimist** [comment]
Blergh! So using `adb shell` I'm able to run tcpdump on my emulator. Here's what I see:

```
% tcpdump -i wlan0 udp port 4433                                                                                         
tcpdump: verbose output suppressed, use -v or -vv for full protocol decode
listening on wlan0, link-type EN10MB (Ethernet), capture size 262144 bytes

11:41:57.451422 IP6 2001:2::e12a:71d9:60be:28f8.43723 > 2001:19f0:4:34::1.4433: UDP, length 1250
11:41:57.755840 IP6 2001:2::e12a:71d9:60be:28f8.43723 > 2001:19f0:4:34::1.4433: UDP, length 1250
11:41:58.360578 IP6 2001:2::e12a:71d9:60be:28f8.43723 > 2001:19f0:4:34::1.4433: UDP, length 1250
11:41:59.564216 IP6 2001:2::e12a:71d9:60be:28f8.43723 > 2001:19f0:4:34::1.4433: UDP, length 1250
11:42:01.456134 IP6 2001:2::e12a:71d9:60be:28f8.43723 > 2001:19f0:4:34::1.4433: UDP, length 1250

```
I see the handshake packets going out, but no packets coming in. It looks like UDP is blocked. @RenjieTang are you able to run tcp dump on your physical device?
